{
  "$schema": "./figma.manifest.schema.json",
  "fileKey": "LFA5EyNbUdPvi8Rbuf2tJC",
  "fileName": "BO UI Kit",
  "lastSyncedVersion": "2375632212003523168",
  "lastSyncedAt": "2026-07-14T01:36:50Z",
  "tokens": {
    "css": "src/index.css",
    "tailwind": "tailwind.config.js",
    "sourcePages": {
      "colors": "1606:9445",
      "typography": "1606:9446",
      "spacing": "1606:9447",
      "effects": "1606:9450"
    },
    "note": "토큰은 컴포넌트 노드에 바인딩돼 있어 get_variable_defs 로 추출. 파운데이션 페이지는 시각 문서라 변수 비어있음."
  },
  "components": [
    {
      "name": "Button",
      "file": "src/components/ui/button.tsx",
      "story": "src/stories/button.story.tsx",
      "figmaPage": "1606:9458",
      "figmaNodeId": "1692:74",
      "variants": {
        "type": [
          "Default",
          "Outline",
          "Secondary",
          "Destructive",
          "DestructiveTinted",
          "Link",
          "Ghost"
        ],
        "size": [
          "Extra-small",
          "Small",
          "Default",
          "Large",
          "Extra-large"
        ],
        "disabled": [
          false,
          true
        ]
      },
      "notes": "icon/rightIcon 슬롯. PillButton(rounded-full)은 `pill` prop 으로 지원(별도 컴포넌트 대신 Button 확장)."
    },
    {
      "name": "Checkbox",
      "file": "src/components/ui/checkbox.tsx",
      "story": "src/stories/checkbox.story.tsx",
      "figmaPage": "1606:9460",
      "figmaNodeId": "5667:129",
      "variants": {
        "isSelected": [
          false,
          true
        ],
        "isParent": [
          false,
          true
        ],
        "disabled": [
          false,
          true
        ],
        "mobile": [
          false,
          true
        ]
      },
      "notes": "라벨 없는 .Selector 박스 전용. IsSelected 가 마스터 게이트(checked=false→빈 박스). Title/Description/Card 가 붙은 CheckBox(1719:1533)는 사용 예시라 미추출."
    },
    {
      "name": "Input",
      "file": "src/components/ui/input.tsx",
      "story": "src/stories/input.story.tsx",
      "figmaPage": "5651:4474",
      "figmaNodeId": "7745:699",
      "variants": {
        "type": [
          "Default",
          "MultiSelect",
          "Focus",
          "Error",
          "ErrorFocused",
          "Disabled",
          "File",
          "InnerLabel"
        ],
        "size": [
          "Small",
          "Default",
          "Large"
        ],
        "fill": [
          false,
          true
        ]
      },
      "notes": "슬롯형 입력(left/right icon, prefix/suffix). 상태: Default/Error(border destructive)/Disabled(opacity64)/Focus(ring). 사이즈 sm/md/lg(h28/32/36). 미구현: 인라인 Button/Badge/Kbd/MultiSelect/File/InnerLabel/Fill=True/darkBackground."
    },
    {
      "name": "Label",
      "file": "src/components/ui/label.tsx",
      "story": "src/stories/label.story.tsx",
      "figmaPage": "5651:4492",
      "figmaNodeId": "7658:2157",
      "variants": {},
      "notes": "접근성 라벨(label 요소). text-xs Medium, foreground. htmlFor 로 컨트롤 연결."
    },
    {
      "name": "Field",
      "file": "src/components/ui/field.tsx",
      "story": "src/stories/field.story.tsx",
      "figmaPage": "5651:4444",
      "figmaNodeId": "7745:713",
      "variants": {
        "type": [
          "Default",
          "Error",
          "Description",
          "Validity"
        ],
        "isRequired": [
          false,
          true
        ]
      },
      "notes": "label+필수*+control children+보조영역. Type→보조영역 prop(error/description/validity) 매핑. label 은 Figma Inter→프로젝트 Pretendard 로 변환."
    },
    {
      "name": "Input OTP",
      "file": "src/components/ui/input-otp.tsx",
      "story": "src/stories/input-otp.story.tsx",
      "figmaNodeId": "8060:1580",
      "variants": {
        "isLarge": [
          false,
          true
        ]
      },
      "notes": "슬롯형 OTP(title+슬롯행+belowText). 6자리 3-3 그룹(InputOTPSeparator). IsLarge→isLarge(32px/36px). 슬롯 상태: 기본/채움(char)/active(다음 입력 위치, disabled 색 링). active 슬롯 색은 Figma `disabled`(#45556c) 토큰 → --disabled 신규 추가."
    },
    {
      "name": "Meter",
      "file": "src/components/ui/meter.tsx",
      "story": "src/stories/meter.story.tsx",
      "figmaNodeId": "7664:31",
      "variants": {
        "showLabels": [
          false,
          true
        ],
        "showSecondaryLabel": [
          false,
          true
        ]
      },
      "notes": "수치 표시 막대(role=meter+aria-value*). 라벨행(label·valueLabel) + 8px 트랙(bg-input)+인디케이터(bg-primary, width=value%). value/min/max prop, 채움% 자동. .MeterBlock(7664:32)은 내부 빌딩블록이라 미추출."
    },
    {
      "name": "Toggle",
      "file": "src/components/ui/toggle.tsx",
      "story": "src/stories/toggle.story.tsx",
      "figmaNodeId": "5685:204",
      "variants": {
        "state": [
          "Default",
          "Active",
          "Hover",
          "Disabled"
        ],
        "isHovered": [
          false,
          true
        ],
        "size": [
          "Small",
          "Default",
          "Large"
        ],
        "iconOnly": [
          false,
          true
        ],
        "isOutline": [
          false,
          true
        ]
      },
      "notes": "2-state 버튼. (2026-06-16) hover 가 State 한 축에서 별도 축 IsHovered(T/F)로 분리됨 → 우리의 직교 :hover 매핑과 1:1(코드 동작 불변). 매핑: pressed(=Active/on)·:hover(=IsHovered)·disabled·기본. on=secondary/64(Figma muted #e2e8f0), on+hover 동일(호버로 안 바뀜), hover(off)=card/50, disabled=opacity50(pointer-events-none이라 hover 무관). IsOutline→variant outline(border+card+shadow). 텍스트=foreground(#1d293d, Figma 'card-foreground'에 대응). (State 에 잔존하는 Hover 값 = Default+IsHovered=True 표현.)"
    },
    {
      "name": "Toggle Group",
      "file": "src/components/ui/toggle-group.tsx",
      "story": "src/stories/toggle-group.story.tsx",
      "figmaNodeId": "5686:270",
      "variants": {
        "outline": [
          false,
          true
        ],
        "orientation": [
          "Horizontal",
          "Vertical"
        ],
        "size": [
          "Small",
          "Default",
          "Large"
        ]
      },
      "notes": "Toggle 들에 공유 상태 제공(세그먼티드). type single/multiple. 아이템 테두리/모서리 이어붙임(그룹 rounded+overflow-hidden, 인접 -ml/-mt px). toggleVariants 재사용."
    },
    {
      "name": "Select",
      "file": "src/components/ui/select.tsx",
      "story": "src/stories/select.story.tsx",
      "figmaNodeId": "7751:1561",
      "variants": {
        "selectItem": {
          "selected": [
            false,
            true
          ],
          "hover": [
            false,
            true
          ]
        }
      },
      "notes": "드롭다운 선택. 패널=popover bg+border+rounded-xl+shadow-popover+gap-px(node 7751:1561). 항목 .SelectItem(7751:1704): h28 rounded-lg text-xs medium accent-foreground, 선택=체크+bg primary/4%, hover=bg accent(#f8fafc). 트리거는 Figma에 없어 Input 관례(회색 3px 포커스)로 디자인. 미구현: ComboBox(검색형)/MultiSelect/fadeOnBot/per-item 아이콘 데모. 신규 토큰: popover/accent/accent-foreground + shadow-popover."
    },
    {
      "name": "Switch",
      "file": "src/components/ui/switch.tsx",
      "story": "src/stories/switch.story.tsx",
      "figmaNodeId": "7715:1962",
      "variants": {
        "size": [
          "Default",
          "Large"
        ],
        "checked": [
          false,
          true
        ],
        "disabled": [
          false,
          true
        ]
      },
      "notes": "on/off 토글. 트랙 off=input(8%)/on=success(#00d492, VariableID:5632:2350)+안쪽그림자, thumb=card+shadow-xs. size md(18×30)/lg(24×44). 제어/비제어(checked/onCheckedChange), role=switch. (2026-06-17: 트랙 on 색 primary→success 재바인딩)"
    },
    {
      "name": "Separator",
      "file": "src/components/ui/separator.tsx",
      "story": "src/stories/separator.story.tsx",
      "figmaNodeId": "3605:3065",
      "variants": {
        "orientation": [
          "Horizontal",
          "Vertical"
        ]
      },
      "notes": "1px 구분선(border 토큰 8%). horizontal=h-px w-full / vertical=w-px h-full. decorative=false 시 role=separator. Figma Spacing 변형은 여백(className margin)으로 처리."
    },
    {
      "name": "Skeleton",
      "file": "src/components/ui/skeleton.tsx",
      "story": "src/stories/skeleton.story.tsx",
      "figmaNodeId": "7669:1885",
      "variants": {},
      "notes": "로딩 플레이스홀더 프리미티브(animate-pulse + bg-secondary). Figma 노드는 아바타+텍스트+버튼 사용 예시라 단위 블록으로 추출(크기/모양은 className). bg=Figma muted #e2e8f0=프로젝트 secondary 토큰."
    },
    {
      "name": "Spinner",
      "file": "src/components/ui/spinner.tsx",
      "story": "src/stories/spinner.story.tsx",
      "figmaNodeId": "7707:393",
      "variants": {
        "size": [
          "sm",
          "md",
          "lg"
        ]
      },
      "notes": "로딩 인디케이터. Figma 회전 프레임(7일 만료 이미지)을 인라인 SVG 링+animate-spin 으로 대체(색 currentColor 상속). size 16/24/32. role=status."
    },
    {
      "name": "Textarea",
      "file": "src/components/ui/textarea.tsx",
      "story": "src/stories/textarea.story.tsx",
      "figmaNodeId": "7751:1067",
      "variants": {
        "focus": [
          false,
          true
        ],
        "size": [
          "Small",
          "Default",
          "Large"
        ],
        "fill": [
          false,
          true
        ],
        "disabled": [
          false,
          true
        ]
      },
      "notes": "여러 줄 입력. Input 의 토큰/포커스 관례 재사용(회색 3px 링, border-input→focus disabled/30, invalid→destructive). bg=background, rounded-radius, shadow-xs, resize-y. size sm/md/lg(최소높이). 코너 그립은 네이티브 resize 로 대체."
    },
    {
      "name": "Avatar",
      "file": "src/components/ui/avatar.tsx",
      "story": "src/stories/avatar.story.tsx",
      "figmaNodeId": "1696:153",
      "variants": {
        "circular": [
          false,
          true
        ],
        "size": [
          "24",
          "28",
          "32",
          "36",
          "40",
          "48"
        ]
      },
      "notes": "이미지+폴백(이니셜). shape circle/square, size xs~2xl(24~48). 폴백 bg=secondary(Figma muted #e2e8f0)/text=muted-foreground. ring(2px background 테두리)=그룹 분리용. 이미지 로드실패 시 폴백."
    },
    {